Other congenital malformations of gallbladder,Q441,Q441,,Yes,
"Nondisplaced fracture of trapezoid [smaller multangular], left wrist, initial encounter for open fracture",S62185B,S62185B,,Yes,
"Infective myositis, unspecified right leg",M60003,M60003,,Yes,
"Unspecified open wound of larynx, initial encounter",S11019A,S11019A,,Yes,
"Unspecified urethral stricture, male, overlapping sites",N35916,N35916,,Yes,
"Nondisplaced fracture of capitate [os magnum] bone, left wrist, subsequent encounter for fracture with routine healing",S62135D,S62135D,,Yes,
"Major osseous defect, right forearm",M89731,M89731,,Yes,
"Poisoning by cannabis, accidental (unintentional), sequela",T40711S,T40711S,,Yes,
"Unspecified open wound of abdominal wall, left lower quadrant with penetration into peritoneal cavity, subsequent encounter",S31604D,S31604D,,Yes,
Adjustment disorder with other symptoms,F4329,F4329,,Yes,
"Maternal care for (suspected) central nervous system malformation or damage in fetus, holoprosencephaly, fetus 4",O3505X4,O3505X4,,Yes,
"Otitic barotrauma, subsequent encounter",T700XXD,T700XXD,,Yes,
"Unspecified superficial injuries of right front wall of thorax, subsequent encounter",S20301D,S20301D,,Yes,
"Occupant of animal-drawn vehicle injured in collision with railway train or railway vehicle, initial encounter",V8062XA,V8062XA,,Yes,
"Salter-Harris Type I physeal fracture of upper end of left tibia, subsequent encounter for fracture with routine healing",S89012D,S89012D,,Yes,
"Nondisplaced fracture of posterior wall of right acetabulum, initial encounter for closed fracture",S32424A,S32424A,,Yes,
"Insect bite (nonvenomous) of right shoulder, subsequent encounter",S40261D,S40261D,,Yes,
Other congenital functional disorders of colon,Q432,Q432,,Yes,
"Toxic effect of cyanides, accidental (unintentional), subsequent encounter",T650X1D,T650X1D,,Yes,
"Laceration with foreign body of unspecified elbow, sequela",S51029S,S51029S,,Yes,
"Displaced fracture of shaft of right clavicle, subsequent encounter for fracture with malunion",S42021P,S42021P,,Yes,
"Stress fracture, right radius, subsequent encounter for fracture with nonunion",M84333K,M84333K,,Yes,
"Toxic effect of venom of gila monster, accidental (unintentional), subsequent encounter",T63111D,T63111D,,Yes,
"Contusion, laceration, and hemorrhage of brainstem with loss of consciousness of 31 minutes to 59 minutes, sequela",S06382S,S06382S,,Yes,
Hereditary sideroblastic anemia,D640,D640,,Yes,
Cryptosporidiosis,A072,A072,,Yes,
Other nonspecific abnormal finding of lung field,R918,R918,,Yes,
"Poisoning by carbonic-anhydrase inhibitors, benzothiadiazides and other diuretics, assault, initial encounter",T502X3A,T502X3A,,Yes,
"Effects of weightlessness, initial encounter",T7582XA,T7582XA,,Yes,
"Other contact with squirrel, sequela",W5329XS,W5329XS,,Yes,
"Burn of unspecified degree of right axilla, sequela",T22041S,T22041S,,Yes,
"Unspecified injury of unspecified muscle, fascia and tendon at shoulder and upper arm level, left arm, initial encounter",S46902A,S46902A,,Yes,
"Other specified injury of unspecified blood vessel at lower leg level, left leg, subsequent encounter",S85992D,S85992D,,Yes,
"Neuroma of amputation stump, left lower extremity",T8734,T8734,,Yes,
"Nondisplaced spiral fracture of shaft of radius, unspecified arm, subsequent encounter for open fracture type I or II with delayed healing",S52346H,S52346H,,Yes,
"Displaced fracture of posterior column [ilioischial] of right acetabulum, subsequent encounter for fracture with delayed healing",S32441G,S32441G,,Yes,
"Acute reactive otitis externa, unspecified ear",H60559,H60559,,Yes,
"Passenger in pick-up truck or van injured in collision with fixed or stationary object in traffic accident, subsequent encounter",V576XXD,V576XXD,,Yes,
"Laceration of intrinsic muscle and tendon at ankle and foot level, right foot, sequela",S96221S,S96221S,,Yes,
"Other specified injuries of right shoulder and upper arm, initial encounter",S4981XA,S4981XA,,Yes,
"Exposure to ignition of plastic jewelry, initial encounter",X060XXA,X060XXA,,Yes,
"Displaced fracture of proximal phalanx of left thumb, subsequent encounter for fracture with malunion",S62512P,S62512P,,Yes,
"Displaced fracture of lateral condyle of right humerus, initial encounter for closed fracture",S42451A,S42451A,,Yes,
"Acute lymphangitis, unspecified",L0391,L0391,,Yes,
"Person on outside of three-wheeled motor vehicle injured in collision with pedestrian or animal in traffic accident, subsequent encounter",V307XXD,V307XXD,,Yes,
"Trigger finger, right middle finger",M65331,M65331,,Yes,
"Unspecified fracture of right lower leg, initial encounter for closed fracture",S8291XA,S8291XA,,Yes,
"Pathological fracture, left ankle, initial encounter for fracture",M84472A,M84472A,,Yes,
"Adverse effect of rifampicins, initial encounter",T366X5A,T366X5A,,Yes,
"Poisoning by local astringents and local detergents, accidental (unintentional), initial encounter",T492X1A,T492X1A,,Yes,
"Other specified injury of superior vena cava, sequela",S2529XS,S2529XS,,Yes,
"Toxic effect of corrosive alkalis and alkali-like substances, accidental (unintentional), sequela",T543X1S,T543X1S,,Yes,
Vascular anomalies of left upper eyelid,H02874,H02874,,Yes,
"Other fracture of right foot, subsequent encounter for fracture with malunion",S92811P,S92811P,,Yes,
"Unspecified soft tissue disorder related to use, overuse and pressure, right forearm",M70931,M70931,,Yes,
"Contusion and laceration of cerebrum, unspecified, with loss of consciousness of 6 hours to 24 hours, initial encounter",S06334A,S06334A,,Yes,
"Nondisplaced comminuted fracture of shaft of radius, left arm, subsequent encounter for open fracture type I or II with routine healing",S52355E,S52355E,,Yes,
"Nondisplaced Maisonneuve's fracture of unspecified leg, subsequent encounter for open fracture type I or II with routine healing",S82866E,S82866E,,Yes,
"Laceration of lung, unspecified, sequela",S27339S,S27339S,,Yes,
Actinic granuloma,L575,L575,,Yes,
"Insect bite (nonvenomous) of left thumb, initial encounter",S60362A,S60362A,,Yes,
"Exposure to flames in controlled fire in building or structure, initial encounter",X020XXA,X020XXA,,Yes,
"Nondisplaced comminuted fracture of shaft of ulna, right arm, subsequent encounter for closed fracture with malunion",S52254P,S52254P,,Yes,
"Military operations involving combat using blunt or piercing object, civilian, sequela",Y37451S,Y37451S,,Yes,
"Pathological fracture, left shoulder, subsequent encounter for fracture with delayed healing",M84412G,M84412G,,Yes,
"Age-related osteoporosis with current pathological fracture, right hand, initial encounter for fracture",M80041A,M80041A,,Yes,
"Postdysenteric arthropathy, unspecified hip",M02159,M02159,,Yes,
"Corrosion of second degree of unspecified lower leg, subsequent encounter",T24639D,T24639D,,Yes,
"Nondisplaced fracture of proximal phalanx of other finger, subsequent encounter for fracture with routine healing",S62648D,S62648D,,Yes,
Activated protein C resistance,D6851,D6851,,Yes,
"Juvenile arthritis, unspecified, left knee",M08962,M08962,,Yes,
"Pathological fracture in other disease, right radius, sequela",M84633S,M84633S,,Yes,
"Laceration with foreign body of right elbow, sequela",S51021S,S51021S,,Yes,
"Corrosion of unspecified degree of left thumb (nail), initial encounter",T23412A,T23412A,,Yes,
"Adverse effect of other laxatives, subsequent encounter",T474X5D,T474X5D,,Yes,
"Toxic effect of latex, undetermined, initial encounter",T65814A,T65814A,,Yes,
Monoplegia of lower limb following nontraumatic intracerebral hemorrhage affecting left dominant side,I69142,I69142,,Yes,
"Unspecified open wound of left middle finger with damage to nail, subsequent encounter",S61303D,S61303D,,Yes,
"Posterior subluxation of right radial head, initial encounter",S53021A,S53021A,,Yes,
Non-pressure chronic ulcer of unspecified thigh with other specified severity,L97108,L97108,,Yes,
"Other injury of flexor muscle, fascia and tendon of right index finger at wrist and hand level, initial encounter",S66190A,S66190A,,Yes,
"Underdosing of tetracyclic antidepressants, subsequent encounter",T43026D,T43026D,,Yes,
"Displaced supracondylar fracture with intracondylar extension of lower end of right femur, subsequent encounter for open fracture type I or II with malunion",S72461Q,S72461M,,No,
"Partial traumatic amputation at left hip joint, subsequent encounter",S78022D,S78022D,,Yes,
"Activity, trampolining",Y9344,Y9344,,Yes,
"Unspecified injury of diaphragm, initial encounter",S27809A,S27809A,,Yes,
"Toxic effect of methanol, undetermined, subsequent encounter",T511X4D,T511X4D,,Yes,
Endometriosis of the sciatic nerve,N80D4,N80D4,,Yes,
"Primary focal hyperhidrosis, palms",L74512,L74512,,Yes,
"Unspecified fracture of lower end of unspecified ulna, initial encounter for closed fracture",S52609A,S52609A,,Yes,
"Contusion and laceration of left cerebrum with loss of consciousness of 6 hours to 24 hours, subsequent encounter",S06324D,S06324D,,Yes,
"Contusion and laceration of cerebrum, unspecified, with loss of consciousness of any duration with death due to other cause prior to regaining consciousness, initial encounter",S06338A,S06338A,,Yes,
"Age-related osteoporosis with current pathological fracture, right shoulder, subsequent encounter for fracture with nonunion",M80011K,M80011K,,Yes,
"Fall on same level from slipping, tripping and stumbling with subsequent striking against unspecified object, initial encounter",W0110XA,W0110XA,,Yes,
"Chronic gout due to renal impairment, unspecified knee, with tophus (tophi)",M1A3691,M1A3691,,Yes,
"Type 1 diabetes mellitus with diabetic macular edema, resolved following treatment, left eye",E1037X2,E1037X2,,Yes,
"Partial traumatic transphalangeal amputation of left index finger, initial encounter",S68621A,S68621A,,Yes,
Benign neoplasm of bladder,D303,D303,,Yes,
"Displaced fracture of medial condyle of left femur, subsequent encounter for open fracture type I or II with delayed healing",S72432H,S72432H,,Yes,
"Poisoning by other viral vaccines, assault, initial encounter",T50B93A,T50B93A,,Yes,
"Nondisplaced spiral fracture of shaft of right fibula, sequela",S82444S,S82444S,,Yes,
"Nondisplaced fracture of posterior process of left talus, subsequent encounter for fracture with delayed healing",S92135G,S92135G,,Yes,
"Maternal care for face, brow and chin presentation, fetus 4",O323XX4,O323XX4,,Yes,
"Underdosing of other antiepileptic and sedative-hypnotic drugs, subsequent encounter",T426X6D,T426X6D,,Yes,
"Other fracture of T5-T6 vertebra, sequela",S22058S,S22058S,,Yes,
"Maternal care for known or suspected placental insufficiency, unspecified trimester, fetus 2",O365192,O365192,,Yes,
"Struck by sea lion, initial encounter",W5612XA,W5612XA,,Yes,
"Lead-induced chronic gout, left hip, without tophus (tophi)",M1A1520,M1A1520,,Yes,
Subcutaneous fat necrosis due to birth injury,P156,P156,,Yes,
"Displaced unspecified condyle fracture of lower end of right femur, subsequent encounter for closed fracture with delayed healing",S72411G,S72411G,,Yes,
"Unspecified donor, other blood",Z52008,Z52008,,Yes,
"Transient synovitis, right shoulder",M67311,M67311,,Yes,
"Strain of flexor muscle, fascia and tendon of left index finger at wrist and hand level, subsequent encounter",S66111D,S66111D,,Yes,
"Infection of nipple associated with pregnancy, second trimester",O91012,O91012,,Yes,
"Unspecified occupant of pick-up truck or van injured in collision with car, pick-up truck or van in traffic accident, subsequent encounter",V539XXD,V539XXD,,Yes,
"Displaced segmental fracture of shaft of radius, unspecified arm, subsequent encounter for open fracture type I or II with nonunion",S52363M,S52363M,,Yes,
"Secondary noninfectious iridocyclitis, unspecified eye",H20049,H20049,,Yes,
"Salter-Harris Type IV physeal fracture of phalanx of unspecified toe, sequela",S99249S,S99249S,,Yes,
"Puncture wound with foreign body of right little finger without damage to nail, subsequent encounter",S61246D,S61246D,,Yes,
"Nondisplaced fracture of posterior wall of right acetabulum, subsequent encounter for fracture with delayed healing",S32424G,S32424G,,Yes,
Foodborne Clostridium perfringens [Clostridium welchii] intoxication,A052,A052,,Yes,
"Acute hematogenous osteomyelitis, left femur",M86052,M86052,,Yes,
"Open bite of left back wall of thorax with penetration into thoracic cavity, subsequent encounter",S21452D,S21452D,,Yes,
"Passenger in heavy transport vehicle injured in collision with car, pick-up truck or van in nontraffic accident, sequela",V631XXS,V631XXS,,Yes,
"Toxic effect of carbon monoxide from utility gas, undetermined, initial encounter",T5814XA,T5814XA,,Yes,
"Other injury of ureter, sequela",S3719XS,S3719XS,,Yes,
"Posterior subluxation of right radial head, subsequent encounter",S53021D,S53021D,,Yes,
"Anterior dislocation of lens, unspecified eye",H27129,H27129,,Yes,
Malignant neoplasm of short bones of right upper limb,C4011,C4011,,Yes,
Rheumatoid myopathy with rheumatoid arthritis of left hip,M05452,M05452,,Yes,
"Sprain of unspecified ligament of unspecified ankle, sequela",S93409S,S93409S,,Yes,
"Other specified injury of radial artery at forearm level, unspecified arm, initial encounter",S55199A,S55199A,,Yes,
"Jumping or diving into swimming pool striking bottom causing other injury, subsequent encounter",W16522D,W16522D,,Yes,
"Fracture of unspecified tarsal bone(s) of unspecified foot, subsequent encounter for fracture with routine healing",S92209D,S92209D,,Yes,
"Poisoning by antiallergic and antiemetic drugs, assault, subsequent encounter",T450X3D,T450X3D,,Yes,
"Pedestrian with other conveyance injured in collision with railway train or railway vehicle in nontraffic accident, sequela",V0509XS,V0509XS,,Yes,
"Terrorism, secondary effects, public safety official injured, initial encounter",Y389X1A,Y389X1A,,Yes,
"Displaced segmental fracture of shaft of unspecified fibula, initial encounter for open fracture type IIIA, IIIB, or IIIC",S82463C,S82463C,,Yes,
"Low vision right eye category 1, blindness left eye category 4",H541214,H541214,,Yes,
"Superficial foreign body of right shoulder, subsequent encounter",S40251D,S40251D,,Yes,
Congenital occlusion of ureteropelvic junction,Q6211,Q6211,,Yes,
"Nondisplaced apophyseal fracture of right femur, subsequent encounter for open fracture type I or II with nonunion",S72134M,S72134M,,Yes,
"Fracture of unspecified tarsal bone(s) of unspecified foot, initial encounter for open fracture",S92209B,S92209B,,Yes,
"Corrosion of third degree of unspecified ankle, subsequent encounter",T25719D,T25719D,,Yes,
"Other specified injuries of other specified part of neck, sequela",S1989XS,S1980XS,,No,
"Blister (nonthermal) of left front wall of thorax, subsequent encounter",S20322D,S20322D,,Yes,
Malignant neoplasm of scrotum,C632,C632,,Yes,
"Upper abdominal pain, unspecified",R1010,R1010,,Yes,
"Unspecified displaced fracture of surgical neck of right humerus, initial encounter for closed fracture",S42211A,S42211A,,Yes,
"Person on outside of bus injured in collision with car, pick-up truck or van in nontraffic accident, sequela",V732XXS,V732XXS,,Yes,
"Other fracture of T9-T10 vertebra, initial encounter for closed fracture",S22078A,S22078A,,Yes,
"Fetal anemia and thrombocytopenia, unspecified trimester, fetus 2",O368292,O368292,,Yes,
"Other osteoporosis with current pathological fracture, left hand, subsequent encounter for fracture with nonunion",M80842K,M80842K,,Yes,
"Anterior displaced fracture of sternal end of right clavicle, subsequent encounter for fracture with routine healing",S42011D,S42011D,,Yes,
"Nondisplaced unspecified fracture of right lesser toe(s), sequela",S92504S,S92504S,,Yes,
"Burn of first degree of nose (septum), subsequent encounter",T2014XD,T2014XD,,Yes,
"Underdosing of aminoglycosides, initial encounter",T365X6A,T365X6A,,Yes,
"Diabetes mellitus due to underlying condition with proliferative diabetic retinopathy with traction retinal detachment not involving the macula, left eye",E083532,E083533,,No,
"Underdosing of mineralocorticoids and their antagonists, subsequent encounter",T500X6D,T500X6D,,Yes,
"Sezary disease, spleen",C8417,C8417,,Yes,
"Toxic effect of contact with stingray, intentional self-harm, sequela",T63512S,T63512S,,Yes,
"Poisoning by other topical agents, undetermined, subsequent encounter",T498X4D,T498X4D,,Yes,
"Injury of other nerves at ankle and foot level, left leg, subsequent encounter",S948X2D,S948X2D,,Yes,
"Elevated blood-pressure reading, without diagnosis of hypertension",R030,R030,,Yes,
"Unspecified occupant of heavy transport vehicle injured in collision with pedestrian or animal in nontraffic accident, sequela",V603XXS,V603XXS,,Yes,
"Displaced fracture of lateral condyle of left tibia, initial encounter for open fracture type I or II",S82122B,S82122B,,Yes,
"Person boarding or alighting a car injured in collision with pedestrian or animal, sequela",V404XXS,V404XXS,,Yes,
"Displaced fracture of neck of second metacarpal bone, left hand, subsequent encounter for fracture with nonunion",S62331K,S62331K,,Yes,
NIHSS score 26,R29726,R29726,,Yes,
"Displaced fracture of epiphysis (separation) (upper) of right femur, subsequent encounter for open fracture type IIIA, IIIB, or IIIC with nonunion",S72021N,S72021N,,Yes,
"Laceration of uterus, subsequent encounter",S3763XD,S3763XD,,Yes,
Burns involving 90% or more of body surface with 50-59% third degree burns,T3195,T3195,,Yes,
"Salter-Harris Type IV physeal fracture of upper end of humerus, unspecified arm, subsequent encounter for fracture with routine healing",S49049D,S49049D,,Yes,
"Poisoning by other viral vaccines, accidental (unintentional), subsequent encounter",T50B91D,T50B91D,,Yes,
"Other specified effects of reduced temperature, sequela",T698XXS,T698XXS,,Yes,
"Driver of snowmobile injured in nontraffic accident, subsequent encounter",V8652XD,V8652XD,,Yes,
"Adverse effect of selective serotonin and norepinephrine reuptake inhibitors, sequela",T43215S,T43215S,,Yes,
"Continuing pregnancy after elective fetal reduction of one fetus or more, unspecified trimester, fetus 4",O3130X4,O3130X4,,Yes,
"Incomplete lesion of L5 level of lumbar spinal cord, subsequent encounter",S34125D,S34125D,,Yes,
"Other synovitis and tenosynovitis, unspecified upper arm",M65829,M65829,,Yes,
"Exposure to sofa fire due to burning cigarette, initial encounter",X0811XA,X0811XA,,Yes,
"Traumatic amputation (partial) of part of thorax, except breast, sequela",S281XXS,S281XXS,,Yes,
"Displaced fracture of lesser trochanter of unspecified femur, subsequent encounter for open fracture type I or II with malunion",S72123Q,S72123Q,,Yes,
"Nondisplaced fracture of proximal phalanx of left middle finger, subsequent encounter for fracture with nonunion",S62643K,S62643K,,Yes,
"Unspecified corneal ulcer, left eye",H16002,H16002,,Yes,
"Open bite of other specified part of neck, subsequent encounter",S1185XD,S1185XD,,Yes,
"Sprain of jaw, unspecified side, subsequent encounter",S0340XD,S0340XD,,Yes,
"Salter-Harris Type IV physeal fracture of phalanx of right toe, subsequent encounter for fracture with delayed healing",S99241G,S99241G,,Yes,
"Other specified injury of radial artery at forearm level, unspecified arm, initial encounter",S55199A,S55199A,,Yes,
"Nondisplaced fracture of medial cuneiform of unspecified foot, subsequent encounter for fracture with routine healing",S92246D,S92246D,,Yes,
"Salter-Harris Type I physeal fracture of upper end of radius, unspecified arm, subsequent encounter for fracture with delayed healing",S59119G,S59119G,,Yes,
"Unspecified fracture of shaft of right femur, subsequent encounter for open fracture type IIIA, IIIB, or IIIC with delayed healing",S72301J,S72301J,,Yes,
"Crushing injury of scrotum and testis, subsequent encounter",S3802XD,S3802XD,,Yes,
"Unspecified B-cell lymphoma, intrathoracic lymph nodes",C8512,C8512,,Yes,
"Toxic effect of venom of hornets, intentional self-harm, initial encounter",T63452A,T63452A,,Yes,
"Unspecified sprain of unspecified great toe, subsequent encounter",S93503D,S93503D,,Yes,
"Subluxation of metacarpophalangeal joint of left ring finger, initial encounter",S63215A,S63215A,,Yes,
"Maternal care for excessive fetal growth, second trimester, fetus 2",O3662X2,O3662X2,,Yes,
"Nondisplaced fracture of base of neck of left femur, subsequent encounter for open fracture type IIIA, IIIB, or IIIC with routine healing",S72045F,S72045N,,No,
"Sledder colliding with stationary object, subsequent encounter",V00222D,V00222D,,Yes,
"Displaced fracture of head of left radius, subsequent encounter for open fracture type I or II with malunion",S52122Q,S52122Q,,Yes,
"Maternal care for viable fetus in abdominal pregnancy, first trimester, fetus 3",O3671X3,O3671X3,,Yes,
Late congenital syphilitic osteochondropathy,A5056,A5056,,Yes,
"Pressure collapse of lung due to anesthesia during pregnancy, third trimester",O29023,O29023,,Yes,
"Displaced fracture of body of unspecified calcaneus, initial encounter for open fracture",S92013B,S92013B,,Yes,
"Displaced simple supracondylar fracture without intercondylar fracture of right humerus, initial encounter for open fracture",S42411B,S42411B,,Yes,
Congenital renal artery stenosis,Q271,Q271,,Yes,
"Car passenger injured in collision with other nonmotor vehicle in traffic accident, subsequent encounter",V466XXD,V466XXD,,Yes,
"Pathological fracture in other disease, right fibula, subsequent encounter for fracture with nonunion",M84663K,M84663K,,Yes,
"Sprain of carpal joint of left wrist, sequela",S63512S,S63512S,,Yes,
"Burn of first degree of left shoulder, initial encounter",T22152A,T22152A,,Yes,
"Unspecified injury of muscle(s) and tendon(s) of anterior muscle group at lower leg level, left leg, subsequent encounter",S86202D,S86202D,,Yes,
"Adverse effect of unspecified drugs, medicaments and biological substances, initial encounter",T50905A,T50905A,,Yes,
"Pathological fracture, left fibula, subsequent encounter for fracture with malunion",M84464P,M84464P,,Yes,
"Strain of other muscles, fascia and tendons at shoulder and upper arm level, left arm, initial encounter",S46812A,S46812A,,Yes,
Kaposi's sarcoma of gastrointestinal sites,C464,C464,,Yes,
Other specified helminthiases,B838,B838,,Yes,
"Nondisplaced fracture of shaft of other metacarpal bone, subsequent encounter for fracture with nonunion",S62358K,S62358K,,Yes,
Tuberculous neuritis,A1783,A1783,,Yes,
"Unspecified superficial injury of right ankle, initial encounter",S90911A,S90911A,,Yes,
"Other injury of heart, unspecified with or without hemopericardium, sequela",S2699XS,S2699XS,,Yes,
"Pathological fracture, left tibia, initial encounter for fracture",M84462A,M84462A,,Yes,
"Acute slipped upper femoral epiphysis, unspecified stability (nontraumatic), right hip",M93061,M93061,,Yes,
"Toxic effect of other specified substances, accidental (unintentional), subsequent encounter",T65891D,T65891D,,Yes,
"Puncture wound without foreign body of right hand, sequela",S61431S,S61431S,,Yes,
"Nondisplaced transverse fracture of right acetabulum, subsequent encounter for fracture with nonunion",S32454K,S32454K,,Yes,
Other nonrheumatic aortic valve disorders,I358,I358,,Yes,
"Pedestrian on skateboard injured in collision with two- or three-wheeled motor vehicle in traffic accident, subsequent encounter",V0212XD,V0212XD,,Yes,
"Cicatricial lagophthalmos unspecified eye, unspecified eyelid",H02219,H02219,,Yes,
Bilateral post-traumatic osteoarthritis of hip,M164,M164,,Yes,
"Hypertensive retinopathy, left eye",H35032,H35032,,Yes,
"Driver of heavy transport vehicle injured in collision with unspecified motor vehicles in nontraffic accident, sequela",V6900XS,V6900XS,,Yes,
"Maternal care for (suspected) central nervous system malformation or damage in fetus, agenesis of the corpus callosum, not applicable or unspecified",O3501X0,O3501X0,,Yes,
"Retention of urine, unspecified",R339,R339,,Yes,
"Nondisplaced fracture of body of left talus, subsequent encounter for fracture with nonunion",S92125K,S92125K,,Yes,
"Nondisplaced fracture of triquetrum [cuneiform] bone, unspecified wrist, subsequent encounter for fracture with routine healing",S62116D,S62116D,,Yes,
"Underdosing of antimycobacterial drugs, sequela",T371X6S,T371X6S,,Yes,
"Rheumatoid bursitis, unspecified wrist",M06239,M06239,,Yes,
Paralytic lagophthalmos left lower eyelid,H02235,H02235,,Yes,
"Preterm labor second trimester with preterm delivery third trimester, fetus 1",O6013X1,O6013X1,,Yes,
"Displaced fracture of neck of first metacarpal bone, unspecified hand, subsequent encounter for fracture with routine healing",S62253D,S62253D,,Yes,
"Late congenital syphilis, unspecified",A507,A507,,Yes,
"Pathological fracture, right hand, initial encounter for fracture",M84441A,M84441A,,Yes,
"Pigmentary glaucoma, unspecified eye, severe stage",H401393,H401393,,Yes,
"Keratomalacia, unspecified eye",H18449,H18449,,Yes,
"Intermittent hydrarthrosis, right hand",M12441,M12441,,Yes,
"Displacement of femoral arterial graft (bypass), sequela",T82322S,T82322S,,Yes,
"Other injury of extensor muscle, fascia and tendon of right middle finger at forearm level, subsequent encounter",S56493D,S56493D,,Yes,
"Other specified diabetes mellitus with mild nonproliferative diabetic retinopathy with macular edema, bilateral",E133213,E133213,,Yes,
"Other psychoactive substance dependence with intoxication, unspecified",F19229,F19229,,Yes,
"Other injury of branches of celiac and mesenteric artery, initial encounter",S35298A,S35298A,,Yes,
"Blister (nonthermal), right great toe, sequela",S90421S,S90421S,,Yes,
"Corrosion of third degree of multiple sites of left ankle and foot, initial encounter",T25792A,T25792A,,Yes,
