Diagnosis Description,Reference Code,Retrieve-Rank,Vanilla GPT-3.5-turbo,Retrieve-Rank Match,Vanilla GPT-3.5 turbo match
"Driver of pick-up truck or van injured in collision with other nonmotor vehicle in nontraffic accident, initial encounter",V560XXA,V560XXA,,Yes,
"Toxic effect of unspecified spider venom, assault, sequela",T63303S,T63303S,,Yes,
"Other specified injury of radial artery at forearm level, left arm, sequela",S55192S,S55192S,,Yes,
"Neurogenic bowel, not elsewhere classified",K592,K592,,Yes,
"Nondisplaced supracondylar fracture with intracondylar extension of lower end of unspecified femur, subsequent encounter for open fracture type IIIA, IIIB, or IIIC with malunion",S72466R,S72466N,,No,
